{
  "alpha_id": "EQ01",
  "configuration": {
    "cost_multiplier": 1.0,
    "embargo_ns": 60000000000,
    "flatten_at_session_end": true,
    "latency_ns": 1000000000,
    "max_decision_age_ns": 60000000000,
    "methods": "v2",
    "n_folds": 4
  },
  "dataset_version": "116b77873de422ddd3b4f875625a0d8bba7dc2850068aae6ed807e944fb34573",
  "experiment_id": "6e4a3431a3acf8a5",
  "feature_version": "585dd7b92b738f9da7df863dba1ac049ff10b75b60a8559baac1e49b6f3062ac",
  "horizon": "1s",
  "model_version": "995362d0c53e541bd1f9db90c65ef1cb32e34e98dbb7e9afb121925d2db6625d",
  "seed": 20260919,
  "test_period": {
    "end_ts": 1787691480577291027,
    "start_ts": 1787616005708237294
  },
  "train_period": {
    "end_ts": 1787615944708237294,
    "start_ts": 1787529602028520532
  },
  "validation_period": {
    "end_ts": 1787616005708237294,
    "start_ts": 1787615944708237294
  }
}
