{
  "alpha_id": "EQ03",
  "configuration": {
    "cost_multiplier": 1.0,
    "embargo_ns": 60000000000,
    "flatten_at_session_end": true,
    "latency_ns": 1000000000,
    "max_decision_age_ns": 60000000000,
    "methods": "v2",
    "n_folds": 4
  },
  "dataset_version": "116b77873de422ddd3b4f875625a0d8bba7dc2850068aae6ed807e944fb34573",
  "experiment_id": "00ebeb2b537b5155",
  "feature_version": "585dd7b92b738f9da7df863dba1ac049ff10b75b60a8559baac1e49b6f3062ac",
  "horizon": "5s",
  "model_version": "f02f49dd0daef381be157888951293578edf1f07b56d5c8cff32a36002e06a2c",
  "seed": 20260919,
  "test_period": {
    "end_ts": 1787691480577291027,
    "start_ts": 1787616005708237294
  },
  "train_period": {
    "end_ts": 1787615940708237294,
    "start_ts": 1787529602028520532
  },
  "validation_period": {
    "end_ts": 1787616005708237294,
    "start_ts": 1787615940708237294
  }
}
